{
  "$schema": "http://json-schema.org/draft-07/schema#",
  "$id": "https://raw.githubusercontent.com/VijayJaybhay/wirebay/main/schemas/tool.schema.json",
  "title": "wirebay tool manifest",
  "type": "object",
  "required": ["id", "name", "configs", "format", "rootKey", "entry"],
  "additionalProperties": false,
  "definitions": {
    "perOsString": {
      "oneOf": [
        { "type": "string" },
        {
          "type": "object",
          "additionalProperties": false,
          "properties": { "win32": { "type": "string" }, "darwin": { "type": "string" }, "linux": { "type": "string" } }
        }
      ]
    },
    "location": {
      "type": "object",
      "required": ["path"],
      "additionalProperties": false,
      "properties": {
        "path": { "$ref": "#/definitions/perOsString" },
        "createIfMissing": { "type": "boolean" }
      }
    }
  },
  "properties": {
    "$schema": { "type": "string" },
    "version": { "type": "integer", "minimum": 1 },
    "id": { "type": "string", "pattern": "^[a-z0-9][a-z0-9-]*$" },
    "name": { "type": "string" },
    "aliases": { "type": "array", "items": { "type": "string", "pattern": "^[a-z0-9][a-z0-9-]*$" } },
    "homepage": { "type": "string" },
    "docs": {
      "type": "object",
      "additionalProperties": false,
      "properties": { "mcp": { "type": "string" }, "changelog": { "type": "string" } }
    },
    "detect": {
      "type": "object",
      "additionalProperties": false,
      "properties": {
        "commands": { "type": "array", "items": { "type": "string" } },
        "paths": { "type": "array", "items": { "$ref": "#/definitions/perOsString" } }
      }
    },
    "configs": {
      "type": "object",
      "minProperties": 1,
      "additionalProperties": false,
      "properties": { "user": { "$ref": "#/definitions/location" }, "project": { "$ref": "#/definitions/location" } }
    },
    "format": { "enum": ["json", "jsonc", "toml", "yaml"] },
    "rootKey": { "type": "string", "minLength": 1 },
    "mergeStrategy": { "enum": ["edit", "managed-block"] },
    "entry": {
      "type": "object",
      "required": ["stdio"],
      "additionalProperties": false,
      "properties": {
        "stdio": { "type": "object", "description": "Template using {command}, {args}, {env}" },
        "extra": { "type": "object" }
      }
    },
    "supports": {
      "type": "object",
      "additionalProperties": false,
      "properties": {
        "stdio": { "type": "boolean" },
        "http": { "type": "boolean" },
        "envExpansion": { "type": "boolean" },
        "cmdShims": { "type": "boolean" }
      }
    },
    "cli": { "type": "object", "additionalProperties": false, "properties": { "list": { "type": "string" } } },
    "adapter": { "type": "string" },
    "restartRequired": { "type": "boolean" },
    "status": { "enum": ["stable", "beta", "deprecated"] },
    "lastVerified": { "type": "string", "pattern": "^\\d{4}-\\d{2}-\\d{2}$" },
    "verifiedVersion": { "type": "string" },
    "maintainers": { "type": "array", "items": { "type": "string" } }
  }
}
